{
  "type": "object",
  "required": [
    "model_id",
    "instance_count_min",
    "review_basis",
    "expected_instances",
    "optional_absent_fields"
  ],
  "additionalProperties": false,
  "properties": {
    "model_id": {
      "const": "redis"
    },
    "instance_count_min": {
      "type": "integer"
    },
    "review_basis": {
      "type": "string"
    },
    "expected_instances": {
      "type": "array",
      "minItems": 1,
      "maxItems": 1,
      "prefixItems": [
        {
          "type": "object",
          "required": [
            "inst_name",
            "ip_addr",
            "port",
            "version",
            "install_path",
            "max_conn",
            "max_mem",
            "database_role",
            "topo_mode",
            "cluster_uuid",
            "slaves",
            "master"
          ],
          "additionalProperties": false,
          "properties": {
            "inst_name": {
              "type": "string"
            },
            "ip_addr": {
              "type": "string"
            },
            "port": {
              "type": "string"
            },
            "version": {
              "type": "string"
            },
            "install_path": {
              "type": "string"
            },
            "max_conn": {
              "type": "string"
            },
            "max_mem": {
              "type": "string"
            },
            "database_role": {
              "type": "string"
            },
            "topo_mode": {
              "type": "string"
            },
            "cluster_uuid": {
              "type": "string"
            },
            "slaves": {
              "type": "string"
            },
            "master": {
              "type": "string"
            }
          }
        }
      ],
      "items": false
    },
    "optional_absent_fields": {
      "type": "array",
      "maxItems": 0
    }
  },
  "$schema": "https://json-schema.org/draft/2020-12/schema"
}
