{
  "model_id": "redis",
  "instance_count_min": 1,
  "review_basis": "独立审阅 Redis 模型字段；源 topo_mode 尚未建模，仅进入 drift，不写入图库",
  "expected_instances": [
    {
      "inst_name": "127.0.0.1-redis-6379",
      "ip_addr": "127.0.0.1",
      "port": "6379",
      "version": "7.4.9",
      "install_path": "",
      "max_conn": "10000",
      "max_mem": "0",
      "database_role": "master",
      "topo_mode": "replication",
      "cluster_uuid": "",
      "slaves": "",
      "master": ""
    }
  ],
  "optional_absent_fields": []
}
